{
  "schema_version": "antinat.evidence/v1",
  "plan": "P02",
  "commit_sha": "c0bf1b2a0045dcb7a140f15d4bcf42187c3bbd16",
  "command": "go test ./spike/network -run '^(TestPortRegistry|TestBindProbeClose|TestProcessLock|TestSecondProcess)' -count=1 -v",
  "result": "SUPPORTED_WITH_LIMITS",
  "artifact_digest": "sha256:ee734c39299992e88640311d5c1203dd2f71f80c96a472e9e385d73cfaaf6eb9",
  "os": "linux/amd64 native",
  "timeout": 60,
  "started_at": "2026-08-11T00:42:45Z",
  "finished_at": "2026-08-11T00:42:45Z",
  "summary": "Linux socket-owning acquire, port 0, wildcard overlap, stale release, concurrent owner, reuse-group interference, symlink rejection, abrupt-owner recovery, listener-close ownership retention, and process lock assertions passed; no native Windows process-lock evidence exists.",
  "evidence_paths": [
    "test/evidence/m0/network/raw/port-registry.log",
    "test/evidence/m0/network/environment.json",
    "spike/network/port_registry_linux.go",
    "spike/network/process_lock_linux.go"
  ]
}
