{
  "schema_version": "antinat.evidence/v1",
  "plan": "P03",
  "commit_sha": "689ca5788321ba80bd9b108230d89024dccbfecd",
  "command": "go test ./spike/windows-identity/... -count=1 -v",
  "result": "NO_GO",
  "artifact_digest": "sha256:d0f3e4d39e8ae97c4b06ac0db25acee6df29e974b922e03a4b6b0c1eb7357a39",
  "os": "cross-build host Ubuntu 24.04.3; Linux 6.8.0-136-generic; target windows/amd64; Go 1.26.5; no native Windows host; router not applicable",
  "timeout": 1800,
  "summary": "owner=sub-agent-sol; approver=pending independent specification and quality/security review; assertions=Windows probe cross-builds DPAPI LocalMachine round-trip, protected key DACL, NT SERVICE SID discovery, and explicit Defender follow-up contract; no native execution occurred; capability promotion=none; scope fallback=Windows identity/firewall remains build-only/unsupported until native service identity, DPAPI, ACL, Defender managed/manual rule ownership, restart, upgrade, and cleanup pass repair=cycle-1: platform-neutral ClassifyCapability fails closed while DefenderRuleMode is UNVALIDATED; probe consumes it",
  "evidence_paths": [
    "spike/windows-identity/README.md",
    "test/evidence/m0/state-security/logs/windows-identity-cross-build.txt",
    "test/evidence/m0/state-security/logs/environment-and-digests.txt",
    "test/evidence/m0/state-security/checksums.sha256"
  ]
}
