{
  "schema_version": "antinat.evidence/v1",
  "plan": "P18",
  "commit_sha": "d2a15dba4feeba29ba09cbaaa115fbba6964dc2f",
  "command": "bash scripts/test-systemd.sh",
  "result": "PASS",
  "artifact_digest": "sha256:b25cbc27db40bd60d35b004ea62e9c1220c459c9f80b90fcccc794d265486b6c",
  "os": "linux/amd64 systemd",
  "timeout": 300,
  "summary": "Shipped signed installer exercised real Controller and Agent install, TLS enrollment, restart, failed-upgrade rollback, successful upgrade, durable online uninstall receipt, purge, and no-residue checks.",
  "evidence_paths": [".hermes/evidence/p18/systemd-smoke.log"]
}
