{
  "schema_version": "antinat.evidence/v1",
  "plan": "P02",
  "commit_sha": "c0bf1b2a0045dcb7a140f15d4bcf42187c3bbd16",
  "command": "go test ./spike/network -run '^(TestHiddenChallenge|TestControlOnly|TestProviderFrame|TestProbeArm|TestReadProviderFrame|TestProbeAgent)' -count=1 -v",
  "result": "PASS",
  "artifact_digest": "sha256:460111d9731dba3ce9842073f7710565c5b03440053647538233ffbcc6469896",
  "os": "linux/amd64 native localhost transport fixture",
  "timeout": 60,
  "started_at": "2026-08-11T00:42:45Z",
  "finished_at": "2026-08-11T00:42:45Z",
  "summary": "Arm/armed, provider-hidden challenge with arm-only ingress secrecy, bounded Ed25519 frame parser, integrated one-socket UDP classification, same-path ACK, signed control receipt, replay/TTL/binding rejection, generic malformed-frame result, invalid-auth attempt preservation, and bounded state assertions passed.",
  "evidence_paths": [
    "test/evidence/m0/network/raw/hidden-challenge.log",
    "test/evidence/m0/network/environment.json",
    "spike/network/hidden_probe.go",
    "spike/network/hidden_probe_test.go"
  ]
}
