{
  "schema_version": "antinat.evidence/v1",
  "plan": "P02",
  "commit_sha": "6c7a223aa6950cd3c5ddeca23abf2c2626207a66",
  "command": "go test ./spike/network -run '^TestTCP(Baseline|SharedPort)' -count=1 -v",
  "result": "PASS",
  "artifact_digest": "sha256:0451778c7ac6457f26f1bd71c77e822f9d0750e0cbd1bc837e77fcb482103a3a",
  "os": "linux/amd64 native",
  "timeout": 60,
  "started_at": "2026-08-09T16:32:28Z",
  "finished_at": "2026-08-09T16:32:28Z",
  "summary": "Linux unique listener plus three connected sockets shared one local tuple with deterministic four-tuple routing; baseline conflict, half-close, and exact close/rebind assertions passed.",
  "evidence_paths": [
    "test/evidence/m0/network/raw/tcp-linux.log",
    "test/evidence/m0/network/environment.json",
    "spike/network/tcp_shared_linux.go",
    "spike/network/tcp_shared_linux_test.go"
  ]
}
