{
  "schema_version": "antinat.evidence/v1",
  "plan": "P18",
  "commit_sha": "562caf3afc6ed80428d4534438ecaf95c7029d7a",
  "command": "command -v rc-service && command -v rc-update; bash scripts/test-installers.sh",
  "result": "SUPPORTED_WITH_LIMITS",
  "artifact_digest": "sha256:2d2a2b08e216a0b41eb33d3deca93948de693b9c822496c2dbd703d4513d907e",
  "os": "linux/amd64 without OpenRC",
  "timeout": 300,
  "summary": "No native OpenRC host was available; isolated installer tests cover OpenRC generation, source safety, rollback, and service-manager paths.",
  "evidence_paths": [".hermes/evidence/p18/openrc-unavailable.log", ".hermes/evidence/p18/installer-smoke.log"]
}
